{
  "signal_id": "rv_20250623_001",
  "timestamp": "2026-06-23T11:45:00Z",
  "type": "cointegration_spread",
  "assets": ["ETH", "BTC"],
  "zscore": -2.34,
  "spread_value": 0.087,
  "expected_convergence_hours": 4.5,
  "risk_score": 0.42,
  "confidence": 0.89,
  "regime": "low_vol_mean_revert",
  "metadata": { "vol_7d": 0.021, "funding_diff": 0.0008, "volume_ratio": 1.67 }
}
